name,code,description,guidanceNotes,levelDescription,technologies,developers
Desenvolvimento Backend,SKILL-BACK-001,Desenvolvimento de APIs e serviços server-side,Foco em Node.js e arquiteturas escaláveis,Níveis de 0 (sem conhecimento) a 5 (expert),"Node.js 20:4:2024-01-01|PostgreSQL 16:4:2024-01-01|Express.js 5:3:2024-02-01","João Silva:5:2024-06-01:Certificado AWS|Maria Santos:4:2024-05-15:Em desenvolvimento"
Desenvolvimento Frontend,SKILL-FRONT-001,Desenvolvimento de interfaces de usuário modernas,Expertise em React e Vue.js,"Escala 0-5, considerando boas práticas e performance","React 19:5:2024-01-01|TypeScript 5:4:2024-01-01|Vue.js 3:3:2024-03-01","Juliana Lima:5:2024-07-01:Certificada React|Pedro Oliveira:4:2024-06-15:"
DevOps e Cloud,SKILL-DEVOPS-001,Operações de desenvolvimento e infraestrutura cloud,Conhecimento em Docker Kubernetes e CI/CD,Proficiência medida por complexidade de projetos,"Docker 24:4:2024-01-01|Kubernetes 1.28:3:2024-02-01|Terraform 1.6:4:2024-01-15","Ana Costa:5:2024-08-01:Certificada Kubernetes|Carlos Souza:3:2024-07-01:Em treinamento"
Arquitetura de Soluções,SKILL-ARCH-001,Design e arquitetura de sistemas complexos,Padrões de arquitetura e design patterns,Avaliação baseada em projetos entregues,"Node.js 20:4:2024-01-01|PostgreSQL 16:4:2024-01-01|AWS 2023:5:2024-01-01","Lucas Martins:5:2024-09-01:Solutions Architect|Maria Santos:4:2024-08-15:"
Banco de Dados,SKILL-DB-001,Administração e otimização de bancos de dados,Expertise em SQL NoSQL e performance tuning,Níveis baseados em complexidade de queries e otimizações,"PostgreSQL 16:5:2024-01-01|MongoDB 7:4:2024-02-01|Redis 7:3:2024-03-01","Fernanda Rocha:5:2024-10-01:DBA Certificada|Roberto Alves:3:2024-09-01:"
